{
  "cache_root": "derived\\parliament_dataset_full_acquisition",
  "inventory_manifest": "manifests/parliament_dataset_inventory.json",
  "manifest_version": 1,
  "policy": {
    "excludes_nz_gazette": true,
    "excludes_nz_legislation": true,
    "hathitrust_not_acquisition_dependency": true,
    "internet_archive_not_acquisition_dependency": true,
    "no_bulk_acquisition": true,
    "no_historical_completeness_claim": true,
    "no_public_release": true,
    "official_sources_first": true,
    "rights_safe": true
  },
  "publication_boundary": "not-public-release-ready",
  "reconciliation": [
    {
      "dataset_family": "journals",
      "notes": "2 bounded targets; 0 fetched; 0 blocked.",
      "reconciliation_status": "pass",
      "shared_hostname": "www3.parliament.nz",
      "source_ids": [
        "nz-parliament-journals-session-indexes",
        "nz-parliament-weekly-journals-archive"
      ]
    },
    {
      "dataset_family": "members_parties_seating_contacts",
      "notes": "4 bounded targets; 0 fetched; 0 blocked.",
      "reconciliation_status": "pass",
      "shared_hostname": "www3.parliament.nz",
      "source_ids": [
        "nz-parliament-former-members",
        "nz-parliament-member-contact-downloads",
        "nz-parliament-members-current",
        "nz-parliament-parties-current"
      ]
    },
    {
      "dataset_family": "order_paper_questions_business_sitting_programme",
      "notes": "3 bounded targets; 0 fetched; 0 blocked.",
      "reconciliation_status": "pass",
      "shared_hostname": "mixed",
      "source_ids": [
        "nz-parliament-oral-questions",
        "nz-parliament-order-paper",
        "nz-parliament-written-questions"
      ]
    },
    {
      "dataset_family": "papers_presented_ajhr",
      "notes": "4 bounded targets; 0 fetched; 0 blocked.",
      "reconciliation_status": "pass",
      "shared_hostname": "mixed",
      "source_ids": [
        "nz-parliament-ajhr",
        "nz-parliament-current-papers",
        "nz-parliament-papers-presented",
        "papers-past-ajhr"
      ]
    },
    {
      "dataset_family": "petitions",
      "notes": "1 bounded targets; 0 fetched; 0 blocked.",
      "reconciliation_status": "pass",
      "shared_hostname": "www3.parliament.nz",
      "source_ids": [
        "nz-parliament-petitions"
      ]
    },
    {
      "dataset_family": "select_committees",
      "notes": "3 bounded targets; 0 fetched; 0 blocked.",
      "reconciliation_status": "pass",
      "shared_hostname": "www3.parliament.nz",
      "source_ids": [
        "nz-parliament-select-committee-meetings",
        "nz-parliament-select-committee-reports",
        "nz-parliament-select-committee-submissions-advice"
      ]
    },
    {
      "dataset_family": "video_audio_calendar",
      "notes": "2 bounded targets; 0 fetched; 0 blocked.",
      "reconciliation_status": "pass",
      "shared_hostname": "mixed",
      "source_ids": [
        "nz-parliament-calendar",
        "nz-parliament-video"
      ]
    }
  ],
  "repository": "corpus-nz-hansard",
  "retrieved_at": "2026-07-03T13:52:59Z",
  "seed_manifest": "manifests/parliament_dataset_seed_fetchers.json",
  "summary": {
    "approved_target_count": 19,
    "blocked_target_count": 0,
    "cache_hit_count": 0,
    "detail_artifact_count": 0,
    "family_count": 7,
    "fetched_target_count": 0,
    "index_only_target_count": 19,
    "reconciled_family_count": 7,
    "resume_hit_count": 0,
    "total_target_count": 19
  },
  "targets": [
    {
      "access_constraints": "Public archive with weekly documents; detail pages may include related links and downloads.",
      "approved": true,
      "blocked_reason": "No detail link could be discovered from the index response.",
      "cache_dir": "derived\\parliament_dataset_full_acquisition\\journals\\nz-parliament-weekly-journals-archive",
      "cache_hit": false,
      "coverage_window": "historic",
      "dataset_family": "journals",
      "detail_artifact_count": 0,
      "detail_paths": [],
      "detail_record_count": 0,
      "detail_sha256s": [],
      "detail_urls": [],
      "fetched_at": "2026-07-03T13:52:58Z",
      "index_cache_path": "derived\\parliament_dataset_full_acquisition\\journals\\nz-parliament-weekly-journals-archive\\index.html",
      "index_fetched_at": "2026-07-03T13:52:58Z",
      "index_record_count": 0,
      "index_sha256": "70c115656c50afdf376c24f671c9326bf658bebd2c6428358326616b66b86f21",
      "index_url": "https://www3.parliament.nz/en/pb/journals-of-the-house/weekly-journals-archive/",
      "proof_status": "index-only",
      "refresh_cadence": "weekly",
      "request_urls": [
        "https://www3.parliament.nz/en/pb/journals-of-the-house/weekly-journals-archive/"
      ],
      "resume_used": false,
      "rights_boundary": "not-public-release-ready",
      "source_id": "nz-parliament-weekly-journals-archive",
      "source_posture": "official"
    },
    {
      "access_constraints": "Public Parliament pages or linked downloads; discover exact current URLs in seed track.",
      "approved": true,
      "blocked_reason": "No detail link could be discovered from the index response.",
      "cache_dir": "derived\\parliament_dataset_full_acquisition\\journals\\nz-parliament-journals-session-indexes",
      "cache_hit": false,
      "coverage_window": "current",
      "dataset_family": "journals",
      "detail_artifact_count": 0,
      "detail_paths": [],
      "detail_record_count": 0,
      "detail_sha256s": [],
      "detail_urls": [],
      "fetched_at": "2026-07-03T13:52:58Z",
      "index_cache_path": "derived\\parliament_dataset_full_acquisition\\journals\\nz-parliament-journals-session-indexes\\index.html",
      "index_fetched_at": "2026-07-03T13:52:58Z",
      "index_record_count": 0,
      "index_sha256": "2b95ec7ad2d94b1dfcc8335c5641f2b626e58aefe4db7352b812c6a8817727fc",
      "index_url": "https://www3.parliament.nz/en/pb/journals-of-the-house/",
      "proof_status": "index-only",
      "refresh_cadence": "weekly",
      "request_urls": [
        "https://www3.parliament.nz/en/pb/journals-of-the-house/"
      ],
      "resume_used": false,
      "rights_boundary": "not-public-release-ready",
      "source_id": "nz-parliament-journals-session-indexes",
      "source_posture": "official"
    },
    {
      "access_constraints": "Public listing and downloads; exact document URLs should be captured in seed manifests.",
      "approved": true,
      "blocked_reason": "No detail link could be discovered from the index response.",
      "cache_dir": "derived\\parliament_dataset_full_acquisition\\papers_presented_ajhr\\nz-parliament-papers-presented",
      "cache_hit": false,
      "coverage_window": "current",
      "dataset_family": "papers_presented_ajhr",
      "detail_artifact_count": 0,
      "detail_paths": [],
      "detail_record_count": 0,
      "detail_sha256s": [],
      "detail_urls": [],
      "fetched_at": "2026-07-03T13:52:58Z",
      "index_cache_path": "derived\\parliament_dataset_full_acquisition\\papers_presented_ajhr\\nz-parliament-papers-presented\\index.html",
      "index_fetched_at": "2026-07-03T13:52:58Z",
      "index_record_count": 0,
      "index_sha256": "9681877492d9d2d3dc3ad86168396d6218c5b4439aa91e8ddf7edc41bc6c00b8",
      "index_url": "https://www3.parliament.nz/en/pb/papers-presented/",
      "proof_status": "index-only",
      "refresh_cadence": "weekly",
      "request_urls": [
        "https://www3.parliament.nz/en/pb/papers-presented/"
      ],
      "resume_used": false,
      "rights_boundary": "not-public-release-ready",
      "source_id": "nz-parliament-papers-presented",
      "source_posture": "official"
    },
    {
      "access_constraints": "Public current papers page; downloads may change.",
      "approved": true,
      "blocked_reason": "No detail link could be discovered from the index response.",
      "cache_dir": "derived\\parliament_dataset_full_acquisition\\papers_presented_ajhr\\nz-parliament-current-papers",
      "cache_hit": false,
      "coverage_window": "current",
      "dataset_family": "papers_presented_ajhr",
      "detail_artifact_count": 0,
      "detail_paths": [],
      "detail_record_count": 0,
      "detail_sha256s": [],
      "detail_urls": [],
      "fetched_at": "2026-07-03T13:52:58Z",
      "index_cache_path": "derived\\parliament_dataset_full_acquisition\\papers_presented_ajhr\\nz-parliament-current-papers\\index.html",
      "index_fetched_at": "2026-07-03T13:52:58Z",
      "index_record_count": 0,
      "index_sha256": "18f0bf290451a60f81990336f51d523454395ef48593b4f76f585b55886e77a3",
      "index_url": "https://www3.parliament.nz/en/pb/papers-presented/current-papers/",
      "proof_status": "index-only",
      "refresh_cadence": "weekly",
      "request_urls": [
        "https://www3.parliament.nz/en/pb/papers-presented/current-papers/"
      ],
      "resume_used": false,
      "rights_boundary": "not-public-release-ready",
      "source_id": "nz-parliament-current-papers",
      "source_posture": "official"
    },
    {
      "access_constraints": "Public Parliament/AJHR surface or linked historical downloads; seed track must verify exact current URL and rights.",
      "approved": true,
      "blocked_reason": "No detail link could be discovered from the index response.",
      "cache_dir": "derived\\parliament_dataset_full_acquisition\\papers_presented_ajhr\\nz-parliament-ajhr",
      "cache_hit": false,
      "coverage_window": "current",
      "dataset_family": "papers_presented_ajhr",
      "detail_artifact_count": 0,
      "detail_paths": [],
      "detail_record_count": 0,
      "detail_sha256s": [],
      "detail_urls": [],
      "fetched_at": "2026-07-03T13:52:58Z",
      "index_cache_path": "derived\\parliament_dataset_full_acquisition\\papers_presented_ajhr\\nz-parliament-ajhr\\index.html",
      "index_fetched_at": "2026-07-03T13:52:58Z",
      "index_record_count": 0,